{
  "bank_name": "ICICI",
  "version": 1,
  "identifiers": {
    "text_contains_any": ["ICICI Bank", "ICICI BANK", "ICIC0", "ICICL"],
    "header_row_contains_any": ["Value Date", "Transaction Remarks", "Withdrawal Amount", "Deposit Amount"]
  },
  "column_map": {
    "date":        { "header_aliases": ["Value Date", "Transaction Date", "Date"] },
    "description": { "header_aliases": ["Transaction Remarks", "Description", "Particulars", "Narration"] },
    "debit":       { "header_aliases": ["Withdrawal Amount", "Withdrawal Amt (INR)", "Debit"] },
    "credit":      { "header_aliases": ["Deposit Amount", "Deposit Amt (INR)", "Credit"] },
    "balance":     { "header_aliases": ["Balance (INR)", "Outstanding Amount (INR)", "Balance"] }
  },
  "debit_credit_style": "separate_columns",
  "date_format": "%d/%m/%Y",
  "number_format": "indian",
  "currency": "INR",
  "known_banner_page_indices": [0],
  "created_from": "manual",
  "last_validated": "2026-07-11",
  "success_rate": 0.90
}
