{
  "bank_name": "SBI",
  "version": 1,
  "identifiers": {
    "text_contains_any": ["State Bank of India", "SBI", "SBIN0", "SBINR"],
    "header_row_contains_any": ["Txn Date", "Description", "Debit", "Credit", "Balance"]
  },
  "column_map": {
    "date":        { "header_aliases": ["Txn Date", "Value Dt", "Date"] },
    "description": { "header_aliases": ["Description", "Particulars", "Narration"] },
    "debit":       { "header_aliases": ["Debit", "Withdrawal", "Dr"] },
    "credit":      { "header_aliases": ["Credit", "Deposit", "Cr"] },
    "balance":     { "header_aliases": ["Balance", "Closing Balance"] }
  },
  "debit_credit_style": "separate_columns",
  "date_format": "%d %b %Y",
  "number_format": "indian",
  "currency": "INR",
  "known_banner_page_indices": [],
  "created_from": "manual",
  "last_validated": "2026-07-11",
  "success_rate": 0.90
}
